{"format": "clementina-song", "version": 1, "id": "e4f5a6b7-c8d9-4e0f-9a1b-2c3d4e5f6a7b", "name": "Theme", "bpm": 120, "stepsPerBeat": 4, "beatsPerBar": 4, "length": 32, "loopStart": 8, "voices": [{"pan": -20, "notes": [{"step": 0, "length": 4, "pitch": 48, "instrumentId": "0d3c6a52-6f0e-4c8e-9a51-2f4f5b0a7c11"}, {"step": 4, "length": 4, "pitch": 52, "instrumentId": "0d3c6a52-6f0e-4c8e-9a51-2f4f5b0a7c11", "legato": true}, {"step": 10, "length": 6, "pitch": 55, "instrumentId": "0d3c6a52-6f0e-4c8e-9a51-2f4f5b0a7c11"}]}, {"pan": 20, "notes": [{"step": 0, "length": 8, "pitch": 24, "instrumentId": "7b1e2d44-93a0-4f7c-8c2b-5e6f7a8b9c0d"}, {"step": 8, "length": 8, "pitch": 31, "instrumentId": "7b1e2d44-93a0-4f7c-8c2b-5e6f7a8b9c0d"}]}, {"pan": 0, "notes": []}, {"pan": 0, "notes": []}]}
